{
  "planVersion": "1.0.0",
  "templateId": "us.irs.f1040sc.2024",
  "templateRevision": "fixture-2024.1",
  "taxYear": 2024,
  "source": {
    "filename": "schedule-c.pdf",
    "sha256": "2d69ea9eb68f1afabed66b30510237d585619a7e56cc16871bd2aac0e78d729c",
    "pageCount": 1
  },
  "geometry": {
    "unit": "pt",
    "origin": "top-left",
    "pages": [
      {
        "width": 612,
        "height": 792
      }
    ]
  },
  "placements": [
    {
      "fieldId": "sc.proprietor",
      "page": 0,
      "rect": [
        36,
        88,
        340,
        16
      ],
      "text": "Dana R Whitfield",
      "font": "Helvetica",
      "size": 9,
      "color": "#000000",
      "align": "left",
      "vAlign": "middle",
      "padding": {
        "top": 0,
        "right": 4,
        "bottom": 0,
        "left": 3
      },
      "overflow": "shrink",
      "minSize": 6,
      "lineHeight": 1.15
    },
    {
      "fieldId": "sc.ssn",
      "page": 0,
      "rect": [
        400,
        88,
        144,
        16
      ],
      "text": "412889017",
      "font": "Courier",
      "size": 9,
      "color": "#000000",
      "align": "center",
      "vAlign": "middle",
      "padding": {
        "top": 0,
        "right": 4,
        "bottom": 0,
        "left": 3
      },
      "overflow": "error",
      "minSize": 6,
      "lineHeight": 1.15,
      "cells": [
        {
          "x": 400,
          "width": 14.222222222222221,
          "char": "4"
        },
        {
          "x": 414.22222222222223,
          "width": 14.222222222222221,
          "char": "1"
        },
        {
          "x": 428.44444444444446,
          "width": 14.222222222222221,
          "char": "2"
        },
        {
          "x": 450.6666666666667,
          "width": 14.222222222222221,
          "char": "8"
        },
        {
          "x": 464.8888888888889,
          "width": 14.222222222222221,
          "char": "8"
        },
        {
          "x": 487.1111111111111,
          "width": 14.222222222222221,
          "char": "9"
        },
        {
          "x": 501.3333333333333,
          "width": 14.222222222222221,
          "char": "0"
        },
        {
          "x": 515.5555555555555,
          "width": 14.222222222222221,
          "char": "1"
        },
        {
          "x": 529.7777777777778,
          "width": 14.222222222222221,
          "char": "7"
        }
      ]
    },
    {
      "fieldId": "sc.principalBusiness",
      "page": 0,
      "rect": [
        36,
        122,
        330,
        16
      ],
      "text": "Engineering consulting services",
      "font": "Helvetica",
      "size": 9,
      "color": "#000000",
      "align": "left",
      "vAlign": "middle",
      "padding": {
        "top": 0,
        "right": 4,
        "bottom": 0,
        "left": 3
      },
      "overflow": "shrink",
      "minSize": 6,
      "lineHeight": 1.15
    },
    {
      "fieldId": "sc.businessName",
      "page": 0,
      "rect": [
        36,
        156,
        330,
        16
      ],
      "text": "Whitfield Structural Consulting",
      "font": "Helvetica",
      "size": 9,
      "color": "#000000",
      "align": "left",
      "vAlign": "middle",
      "padding": {
        "top": 0,
        "right": 4,
        "bottom": 0,
        "left": 3
      },
      "overflow": "shrink",
      "minSize": 6,
      "lineHeight": 1.15
    },
    {
      "fieldId": "sc.ein",
      "page": 0,
      "rect": [
        400,
        156,
        144,
        16
      ],
      "text": "883310542",
      "font": "Courier",
      "size": 9,
      "color": "#000000",
      "align": "center",
      "vAlign": "middle",
      "padding": {
        "top": 0,
        "right": 4,
        "bottom": 0,
        "left": 3
      },
      "overflow": "error",
      "minSize": 6,
      "lineHeight": 1.15,
      "cells": [
        {
          "x": 400,
          "width": 14.88888888888889,
          "char": "8"
        },
        {
          "x": 414.8888888888889,
          "width": 14.88888888888889,
          "char": "8"
        },
        {
          "x": 439.77777777777777,
          "width": 14.88888888888889,
          "char": "3"
        },
        {
          "x": 454.6666666666667,
          "width": 14.88888888888889,
          "char": "3"
        },
        {
          "x": 469.55555555555554,
          "width": 14.88888888888889,
          "char": "1"
        },
        {
          "x": 484.44444444444446,
          "width": 14.88888888888889,
          "char": "0"
        },
        {
          "x": 499.33333333333337,
          "width": 14.88888888888889,
          "char": "5"
        },
        {
          "x": 514.2222222222222,
          "width": 14.88888888888889,
          "char": "4"
        },
        {
          "x": 529.1111111111111,
          "width": 14.88888888888889,
          "char": "2"
        }
      ]
    },
    {
      "fieldId": "sc.method.cash",
      "page": 0,
      "rect": [
        130,
        187,
        10,
        10
      ],
      "text": "X",
      "font": "Helvetica",
      "size": 8,
      "color": "#000000",
      "align": "center",
      "vAlign": "middle",
      "padding": {
        "top": 0,
        "right": 0,
        "bottom": 0,
        "left": 0
      },
      "overflow": "error",
      "minSize": 6,
      "lineHeight": 1.15
    },
    {
      "fieldId": "sc.line1",
      "page": 0,
      "rect": [
        462,
        240,
        92,
        14
      ],
      "text": "128400",
      "font": "Helvetica",
      "size": 9,
      "color": "#000000",
      "align": "right",
      "vAlign": "middle",
      "padding": {
        "top": 0,
        "right": 4,
        "bottom": 0,
        "left": 3
      },
      "overflow": "error",
      "minSize": 6,
      "lineHeight": 1.15
    },
    {
      "fieldId": "sc.line1#cents",
      "page": 0,
      "rect": [
        556,
        240,
        30,
        14
      ],
      "text": "00",
      "font": "Helvetica",
      "size": 9,
      "color": "#000000",
      "align": "center",
      "vAlign": "middle",
      "padding": {
        "top": 0,
        "right": 4,
        "bottom": 0,
        "left": 3
      },
      "overflow": "error",
      "minSize": 6,
      "lineHeight": 1.15
    },
    {
      "fieldId": "sc.line2",
      "page": 0,
      "rect": [
        462,
        262,
        92,
        14
      ],
      "text": "2150",
      "font": "Helvetica",
      "size": 9,
      "color": "#000000",
      "align": "right",
      "vAlign": "middle",
      "padding": {
        "top": 0,
        "right": 4,
        "bottom": 0,
        "left": 3
      },
      "overflow": "error",
      "minSize": 6,
      "lineHeight": 1.15
    },
    {
      "fieldId": "sc.line2#cents",
      "page": 0,
      "rect": [
        556,
        262,
        30,
        14
      ],
      "text": "00",
      "font": "Helvetica",
      "size": 9,
      "color": "#000000",
      "align": "center",
      "vAlign": "middle",
      "padding": {
        "top": 0,
        "right": 4,
        "bottom": 0,
        "left": 3
      },
      "overflow": "error",
      "minSize": 6,
      "lineHeight": 1.15
    },
    {
      "fieldId": "sc.line3",
      "page": 0,
      "rect": [
        462,
        284,
        92,
        14
      ],
      "text": "126250",
      "font": "Helvetica",
      "size": 9,
      "color": "#000000",
      "align": "right",
      "vAlign": "middle",
      "padding": {
        "top": 0,
        "right": 4,
        "bottom": 0,
        "left": 3
      },
      "overflow": "error",
      "minSize": 6,
      "lineHeight": 1.15
    },
    {
      "fieldId": "sc.line3#cents",
      "page": 0,
      "rect": [
        556,
        284,
        30,
        14
      ],
      "text": "00",
      "font": "Helvetica",
      "size": 9,
      "color": "#000000",
      "align": "center",
      "vAlign": "middle",
      "padding": {
        "top": 0,
        "right": 4,
        "bottom": 0,
        "left": 3
      },
      "overflow": "error",
      "minSize": 6,
      "lineHeight": 1.15
    },
    {
      "fieldId": "sc.line7",
      "page": 0,
      "rect": [
        462,
        306,
        92,
        14
      ],
      "text": "126250",
      "font": "Helvetica",
      "size": 9,
      "color": "#000000",
      "align": "right",
      "vAlign": "middle",
      "padding": {
        "top": 0,
        "right": 4,
        "bottom": 0,
        "left": 3
      },
      "overflow": "error",
      "minSize": 6,
      "lineHeight": 1.15
    },
    {
      "fieldId": "sc.line7#cents",
      "page": 0,
      "rect": [
        556,
        306,
        30,
        14
      ],
      "text": "00",
      "font": "Helvetica",
      "size": 9,
      "color": "#000000",
      "align": "center",
      "vAlign": "middle",
      "padding": {
        "top": 0,
        "right": 4,
        "bottom": 0,
        "left": 3
      },
      "overflow": "error",
      "minSize": 6,
      "lineHeight": 1.15
    },
    {
      "fieldId": "sc.partII.expenses[0].category",
      "page": 0,
      "rect": [
        36,
        360,
        300,
        14
      ],
      "text": "Advertising",
      "font": "Helvetica",
      "size": 9,
      "color": "#000000",
      "align": "left",
      "vAlign": "middle",
      "padding": {
        "top": 0,
        "right": 4,
        "bottom": 0,
        "left": 3
      },
      "overflow": "shrink",
      "minSize": 6,
      "lineHeight": 1.15
    },
    {
      "fieldId": "sc.partII.expenses[0].amount",
      "page": 0,
      "rect": [
        462,
        360,
        92,
        14
      ],
      "text": "4200.00",
      "font": "Helvetica",
      "size": 9,
      "color": "#000000",
      "align": "right",
      "vAlign": "middle",
      "padding": {
        "top": 0,
        "right": 4,
        "bottom": 0,
        "left": 3
      },
      "overflow": "error",
      "minSize": 6,
      "lineHeight": 1.15
    },
    {